{
  "schema": "ctx.version.v1",
  "contract_version": 0,
  "version": "0.6.9",
  "commit": "0c1d2e3f4a5b6c7d8e9f0a1b2c3d4e5f60718293",
  "date": "2026-10-01T12:00:00Z",
  "dev_build": false,
  "os": "darwin",
  "arch": "arm64",
  "capabilities": [
    "status.json",
    "status.offline",
    "show.base",
    "show.server",
    "show.sha",
    "pull.json",
    "push.json",
    "push.paths",
    "push.distill_guard",
    "resolve",
    "errors.envelope"
  ]
}
